{
  "event_id": "66666666-6666-4666-8666-666666666666",
  "event_version": 1,
  "occurred_at": "2026-08-21T00:00:00.000Z",
  "recorded_at": "2026-08-21T00:00:00.001Z",
  "workspace_id": "11111111-1111-4111-8111-111111111111",
  "actor": { "type": "user", "id": "33333333-3333-4333-8333-333333333333" },
  "action": "member.role_changed",
  "target": { "type": "membership", "id": "22222222-2222-4222-8222-222222222222" },
  "result": "success",
  "correlation_id": "77777777-7777-4777-8777-777777777777",
  "metadata": { "role": "viewer" }
}
